{
  "$schema": "https://json-schema.org/draft/2020-12/schema",
  "title": "Decodex social publish reservation",
  "type": "object",
  "additionalProperties": false,
  "required": [
    "schema",
    "slug",
    "channel",
    "target_account",
    "controller_account",
    "mode",
    "status",
    "idempotency_key",
    "reserved_at",
    "expires_at",
    "day",
    "timezone",
    "candidate_refs",
    "duplicate_keys"
  ],
  "properties": {
    "schema": {
      "const": "social_publish_reservation/v1"
    },
    "slug": {
      "type": "string",
      "minLength": 1
    },
    "channel": {
      "const": "x"
    },
    "target_account": {
      "const": "decodexspace"
    },
    "controller_account": {
      "const": "hackink"
    },
    "mode": {
      "type": "string",
      "enum": [
        "release_pulse",
        "release_rollup",
        "practical_explainer",
        "operator_impact",
        "thread",
        "watch_note"
      ]
    },
    "status": {
      "type": "string",
      "enum": ["active", "canceled", "consumed", "expired"]
    },
    "idempotency_key": {
      "type": "string",
      "minLength": 1
    },
    "reserved_at": {
      "type": "string",
      "format": "date-time"
    },
    "expires_at": {
      "type": "string",
      "format": "date-time"
    },
    "day": {
      "type": "string",
      "pattern": "^\\d{4}-\\d{2}-\\d{2}$"
    },
    "timezone": {
      "type": "string",
      "minLength": 1
    },
    "candidate_refs": {
      "type": "object",
      "additionalProperties": false,
      "anyOf": [
        {
          "required": ["social_candidates"]
        },
        {
          "required": ["urls"]
        }
      ],
      "properties": {
        "social_candidates": {
          "type": "array",
          "minItems": 1,
          "items": {
            "type": "string",
            "minLength": 1
          }
        },
        "urls": {
          "type": "array",
          "minItems": 1,
          "items": {
            "type": "string",
            "pattern": "^https://"
          }
        }
      }
    },
    "duplicate_keys": {
      "type": "array",
      "minItems": 1,
      "items": {
        "type": "string",
        "minLength": 1
      }
    },
    "owner": {
      "type": "object",
      "additionalProperties": false,
      "properties": {
        "automation_id": {
          "type": "string",
          "minLength": 1
        },
        "run_id": {
          "type": "string",
          "minLength": 1
        },
        "branch": {
          "type": "string",
          "minLength": 1
        },
        "pr_url": {
          "type": "string",
          "pattern": "^https://"
        }
      }
    },
    "evidence_notes": {
      "type": "array",
      "items": {
        "type": "string",
        "minLength": 1
      }
    },
    "consumed_by_social_post": {
      "type": "string",
      "minLength": 1
    },
    "release_reason": {
      "type": "string",
      "minLength": 1
    }
  },
  "allOf": [
    {
      "if": {
        "properties": {
          "status": {
            "const": "active"
          }
        }
      },
      "then": {
        "not": {
          "anyOf": [
            {"required": ["consumed_by_social_post"]},
            {"required": ["release_reason"]}
          ]
        }
      }
    },
    {
      "if": {
        "properties": {
          "status": {
            "const": "consumed"
          }
        }
      },
      "then": {
        "required": ["consumed_by_social_post"],
        "not": {
          "required": ["release_reason"]
        }
      }
    },
    {
      "if": {
        "properties": {
          "status": {
            "enum": ["canceled", "expired"]
          }
        }
      },
      "then": {
        "required": ["release_reason"],
        "not": {
          "required": ["consumed_by_social_post"]
        }
      }
    }
  ]
}
